"school","police_measures_list","swept","skirmish","campus_access","escorted","counter_protestors","arrested_others"
"Virginia Commonwealth University","NA, NA, on scene, on scene in small numbers through day; large contingent of reinforcements arrived in evening; riot gear with shields; formed skirmish lines and advanced on camp; sprayed pepper spray at demonstrators; forcibly arrested numerous protesters, on scene",0,1,0,0,0,0
"Washington University","NA, called to scene; arrest warnings for protesters inside venue, NA, on scene; bicycles; declared unlawful assembly, gave dispersal order and arrest warnings mid-afternoon; police from other area jurisdictions arrived on scene, arrived on scene in large numbers; officers from five departments; bicycles; forcibly arrested demonstrators; zip tied demonstrators hands, on scene in cars parked nearby, on scene; redirected traffic away from demonstrators; detained counter-protester, NA, on scene, NA",0,0,0,0,1,0
"Arizona Western College","on scene; escorted protesters out of venue",0,0,0,1,0,0
"Baruch College","on scene; followed marchers, on scene; drone, NA, NA, NA, on scene; barricades to separate rally-goers and counter-protesters",0,0,0,0,1,0
"Binghamton University","on scene; local and state police; intervened in confrontations; formed line to separate rally-goers and counter-protesters, NA, NA, on scene; formed line between rally-goers and counter-protesters, on scene; removed banner",0,0,0,0,1,0
"Boston College","on scene",0,0,0,0,0,0
"Boston University","NA, NA, NA, NA, on scence, NA, NA, NA, NA, on scene at entrances to buildings on march route; blocked or discouraged protesters from entering, NA, one scene in neon jackets and bikes; created a line surrounding the protest",0,0,1,0,0,0
"Brandeis University","on scene; university and local police; surrounded rally and gave dispersal order; declared unlawful assembly and gave arrest warning; drove cruiser onto lawn; forcibly arrested several protesters, on scene nearby",0,0,0,0,0,0
"Brooklyn College","on scene; barricades, NA, NA, NA, NA, NA",0,0,0,0,0,0
"CUNY Chancellors Office, 205 E 42nd St","on scene; barricades; intervened in verbal confrontation of demonstrators by counter-protesters; scooters",0,0,0,0,1,0
"CUNY Graduate Center","on scene; barricades, on scene; barricades, NA, on scene in large numbers outside building; SRG; TARU, on scene in large numbers outside building; SRG; TARU",0,0,1,0,0,0
"CUNY Silberman School of Social Work","on scene; stood between protesters and counter-protesters; flew a drone over the area",0,0,0,0,1,0
"CUNY","on scene; barricades; followed and directed marchers on foot and scooters; intervened in some confrontations between marchers and counter-protesters; stood in line in between protesters and counter-protesters in Times Square, NA, on scene in large numbers; barricades; bus for possible arrests; intervened in verbal clash between protesters and counter-protesters; stood in lines in front of buildings; closed entrance to World Trade Center as marchers approached; ordered protesters to put out smoke, NA, on scene; manned barricades in front of building entrance, NA, on scene in large numbers; intervened as counter-protesters approached and shouted at rally-goers and erected barricades to designate adjacent areas for rally and counter-protest; bicycles; followed marchers; blocked entrances to Grand Central Terminal",0,0,1,0,1,0
"California Polytechnic State University San Luis Obispo","NA, on scene; attempted to place barricades to block protesters' approach to entrance to campus Rec Center; forcibly arrested numerous protesters; protesters said police punched and knelt on neck of one protester, on scene; stopped counter-protester from walking through die-in, NA, called to scene; issued a dispersal order; about 15 officers surrounded the chained students; Sheriff’s deputies in riot gear formed a perimeter while police officers detached the protesters from the barricade and detained them one at a time",0,1,0,0,1,0
"California State University Long Beach","NA, NA, NA, NA, NA, on scene in large numbers; barricades to block protesters from approaching venue where Board of Trustees were meeting; helicopter",0,0,0,0,0,0
"Carnegie Mellon University","on scene, NA, NA, NA, NA",0,0,0,0,0,0
"Christopher Newport University","NA, NA, on scene; warned demonstrators they would be arrested if they remained on campus",0,0,0,0,0,0
"Clemson University","on scene, NA, NA, NA",0,0,0,0,0,0
"College of Staten Island","on scene; barricades, NA, on scene, on scene; barricades; intervened in confrontation between counter-protester and demonstrators; pushed demonstrators; LRAD, on scene in large numbers; SRG; TARU; barricades",0,1,0,0,1,0
"Colorado State University","NA, NA, on scene, on scene",0,0,0,0,0,0
"Florida Atlantic University","on scene, on scene; intervened in confrontation between marchers and counter-protesters; forcibly arrested at least one marcher, on scene in large numbers from numerous law enforcement agencies; FAUPD parked armored vehicle nearby; intervened in unspecified confrontation between vigil-goers and counter-protesters",0,0,0,0,1,0
"Florida International University","on scene; stood between rally and counter-protesters, NA, NA, on scene; barricades blocking access to steps where die-in was planned; conversed with organizers; opened half of steps to demonstrators, NA, NA, NA, NA, NA, NA, NA, NA",0,0,1,0,1,0
"Franklin & Marshall College","on scene",0,0,0,0,0,0
"Gallaudet University","on scene; stood between protesters and room where event was occurring, NA",0,0,0,0,0,0
"George Mason University","on scene; K-9 unit, NA, on scene, NA, NA, NA, NA, escorted some protesters out of commencement and degree celebrations",0,0,0,1,0,0
"Georgia State University","on scene; negotiated with rally-goers over entrance to university administration building, on scene; led protesters out of ceremony; removed protesters' sign, on scene; motorcycles; stood in marcher's path; scuffled with marchers who tried to pass police line; followed marchers in SUV",0,1,1,1,0,0
"Hofstra University","on scene, NA, campus public safety on scene; led counter-protester away from rally",0,0,0,0,1,0
"Hostos Community College","on scene; barricades",0,0,0,0,0,0
"Hunter College","NA, NA, NA, NA, NA, NA, NA, on scene in large numbers; barricades; followed marchers; LRAD; arrest warnings for marching in street; forcibly arrested protesters near Met; helicopter, on scene in large numbers; barricades; SRG; bicycles; followed marchers, on scene; followed marchers",0,0,0,0,0,0
"John Jay College of Criminal Justice","NA, on scene, NA, NA, NA",0,0,0,0,0,0
"Kansas State University","on scene",0,0,0,0,0,0
"Kennesaw State University","on scene",0,0,0,0,0,0
"Kent State University","on scene, NA, NA",0,0,0,0,0,0
"Kingsborough Community College","on scene; closed campus",0,0,0,0,0,0
"Lehigh University","NA, NA, on scene; told demonstrators not put objects on flagpole",0,0,0,0,0,0
"Louisiana State University","NA, NA, on scene; formed line between demonstrators and counter-protesters outside Student Union",0,0,0,0,1,0
"Loyola Marymount University","on scene, NA, NA",0,0,0,0,0,0
"Loyola University","NA, on scene at a distance",0,0,0,0,0,0
"Madison Area Technical College","on scene; stood in skirmish line between protesters and venue",0,1,0,0,0,0
"Massachusetts Institute of Technology","on scene",0,0,0,0,0,0
"Mercer University","on scene",0,0,0,0,0,0
"Millersville University","on scene",0,0,0,0,0,0
"Montserrat College of Art","on scene",0,0,0,0,0,0
"Morehouse College","on scene; detained student, NA, NA, NA, on scene",0,0,0,0,0,0
"New Mexico State University","NA, NA, called to scene; university and local and state; dispersal order and arrest warnings; forcibly arrested participants in sit-in, NA",0,0,0,0,0,0
"New York University Tandon School of Engineering","called to scene",0,0,0,0,0,0
"North Carolina State University","NA, NA, university and city police on scene; arrested demonstrator using megaphone, NA",0,0,0,0,0,0
"Northern Illinois University","NA, NA, on scene, NA",0,0,0,0,0,0
"Oklahoma State University","NA, on scene in small numbers",0,0,0,0,0,0
"Old Dominion University","university and local police on scene; bicycles",0,0,0,0,0,0
"Pennsylvania State University","on scene, called to scene; observed, on scene, NA, NA, NA, on scene, on scene; followed march; bicycles",0,0,0,0,0,0
"Rice University","NA, NA, NA, NA, on scene; designated protest area with barricades; seized banners and led protesters out of event venue, NA, NA, NA",0,0,0,0,0,0
"Rio Salado College","on scene",0,0,0,0,0,0
"Rutgers University Livingston Campus","called to scene; forcibly removed protesters from Business School at 10:30 PM",0,0,0,1,0,0
"Silberman School of Social Work Hunter College","on scene",0,0,0,0,0,0
"Smith College","NA, NA, NA, NA, NA, on scene; assisted by private security, on scene; assisted by private security, NA, NA, NA, NA, NA, NA, NA, NA, NA, NA, NA, NA, NA",0,0,0,0,0,0
"Southern Connecticut State University","NA, on scene; escorted protesters out of meeting room",0,0,0,1,0,0
"Southern Illinois University","on scene",0,0,0,0,0,0
"St. Louis University","NA, on scene in small numbers",0,0,0,0,0,0
"Texas Christian University","on scene; removed protesters from room",0,0,0,1,0,0
"The Cooper Union","on scene, NA",0,0,0,0,0,0
"Towson State University","NA, on scene with school staff; told students to go outside, on scene; arrest warnings for failing to move to designated protest area; issued citations",0,0,0,0,0,0
"United States Air Force Academy","on scene; blocked entrance to Air Force Academy",0,0,0,0,0,0
"University of Alabama","on scene; stood between rally-goers and counter-protesters",0,0,0,0,1,0
"University of Arkansas","on scene; escorted marchers in cruiser, NA",0,0,0,1,0,0
"University of Colorado Boulder","NA, NA, on scene",0,0,0,0,0,0
"University of Colorado Denver","on scene",0,0,0,0,0,0
"University of Illinois Chicago","NA, on scene; blocked entrance to building; stood between protesters and building, on scene; barricades, NA, NA",0,0,1,0,0,0
"University of Kentucky","called to scene; arrest warnings for trespass; escorted protesters out of venue",0,0,0,1,0,0
"University of Maryland","NA, NA, NA, NA, NA, on scene; escorted protesters out of venue, NA, NA, NA, NA, NA, NA, NA, NA, NA, NA, on scene; barricades; designated protest area with bag checks and metal detectors at police-controlled entrances, NA",0,0,0,1,0,0
"University of Mississippi","NA, on scene in small numbers; barricades; designated protest area; led demonstrators away as situation escalated; stood between protesters and counter-protesters",0,0,0,0,1,0
"University of Missouri","NA, NA, NA, NA, NA, NA, NA, NA, NA, NA, NA, NA, NA, NA, NA, NA, NA, NA, NA, NA, NA, NA, NA, NA, NA, two officers on scene, NA, NA, NA, NA, NA, NA, NA, NA, NA, NA, NA, NA, NA, NA, NA, NA, NA, NA, NA",0,0,0,0,0,0
"University of Nebraska","NA, on scene in small numbers",0,0,0,0,0,0
"University of Nevada Las Vegas","NA, NA, NA, NA, on scene; escorted counter-protesters away from rally, NA, NA, NA, NA, NA, NA, NA, NA",0,0,0,1,1,0
"University of Nevada Reno","NA, on scene; heavily armed officer described by protesters as sniper staged on university balcony overlooking event, NA, NA, NA",0,0,0,0,0,0
"University of North Texas","NA, NA, on scene; removed protesters from event venue, took their personal info, and released them, on scene",0,0,0,1,0,0
"University of Oklahoma","NA, on scene, NA",0,0,0,0,0,0
"University of South Carolina","NA, called to scene; followed protesters as they dispersed and made arrests",0,0,0,0,0,0
"University of Southern Indiana","on site",0,0,0,0,0,0
"University of Southern Mississippi","on scene; warned protesters to limit action to 1 hour because it was unpermitted",0,0,0,0,0,0
"University of Tennessee","NA, arrived on scene around midnight; riot gear and gas masks, on scene; installed surveillance camera at site in morning, NA, on scene; dispersal order and arrest warnings delivered via robot after 10 PM",0,0,0,0,0,0
"University of Tennessee College of Law","on scene",0,0,0,0,0,0
"University of Texas San Antonio","NA, on scene; bicycles",0,0,0,0,0,0
"University of Toledo","NA, on scene; police and staff escorted protesters out of venue",0,0,0,1,0,0
"University of Wisconsin  Green Bay","3 campus police attempted to intimidate protestors",0,0,0,0,0,0
"University of Wisconsin Oshkosh","on scene; bicycles; walked with marchers",0,0,0,0,0,0
"University of Wyoming","on scene",0,0,0,0,0,0
"Valencia College","NA, called to scene in large numbers",0,0,0,0,0,0
"Wellesley College","NA, on scene; barricades; designated protest area",0,0,0,0,0,0
"Worcester State University","on scene; formed line in front of speaker as disruption occurred, NA",0,0,0,0,0,0
"Wright State University","on scene at distance",0,0,0,0,0,0
"Xavier University","on scene; asked protesters to relocate or face arrest",0,0,0,0,0,0
